{
  "schemaVersion": "1.1.0",
  "milestone": "M3–M5",
  "backbones": {
    "runtime": [
      "question",
      "assistant",
      "connection",
      "retrieve",
      "store",
      "support",
      "explain",
      "user"
    ],
    "engineering": [
      "goal",
      "design",
      "rules",
      "implementation",
      "testing",
      "verification",
      "recovery",
      "release",
      "operations",
      "improve"
    ]
  },
  "nodes": [
    {
      "id": "question",
      "labels": {
        "ko-KR": "내 질문",
        "en": "My question"
      },
      "content": {
        "ko-KR": "ko-KR/question.md",
        "en": "en/question.md"
      },
      "branches": [],
      "referenceIds": [],
      "claimIds": [],
      "architectureNodeIds": [
        "mcp"
      ]
    },
    {
      "id": "assistant",
      "labels": {
        "ko-KR": "Claude / GPT",
        "en": "Claude / GPT"
      },
      "content": {
        "ko-KR": "ko-KR/assistant.md",
        "en": "en/assistant.md"
      },
      "branches": [],
      "referenceIds": [],
      "claimIds": [],
      "architectureNodeIds": [
        "mcp"
      ]
    },
    {
      "id": "connection",
      "labels": {
        "ko-KR": "MCP",
        "en": "MCP"
      },
      "content": {
        "ko-KR": "ko-KR/connection.md",
        "en": "en/connection.md"
      },
      "branches": [],
      "referenceIds": [],
      "claimIds": [],
      "term": "mcp",
      "documentId": "mcp",
      "architectureNodeIds": [
        "mcp"
      ]
    },
    {
      "id": "retrieve",
      "labels": {
        "ko-KR": "읽을 수 있는 자료 찾기",
        "en": "Find permitted material"
      },
      "content": {
        "ko-KR": "ko-KR/retrieve.md",
        "en": "en/retrieve.md"
      },
      "branches": [
        "words",
        "meaning",
        "links"
      ],
      "referenceIds": [],
      "claimIds": [],
      "architectureNodeIds": [
        "keyword"
      ],
      "opposite": {
        "axis": "engineering",
        "node": "quality"
      }
    },
    {
      "id": "store",
      "labels": {
        "ko-KR": "저장된 근거·관계 읽기",
        "en": "Read stored evidence and links"
      },
      "content": {
        "ko-KR": "ko-KR/store.md",
        "en": "en/store.md"
      },
      "branches": [
        "relation-subjects"
      ],
      "referenceIds": [],
      "claimIds": [],
      "architectureNodeIds": [
        "neo4j"
      ]
    },
    {
      "id": "support",
      "labels": {
        "ko-KR": "답변에 쓸 근거 반환",
        "en": "Return supporting material"
      },
      "content": {
        "ko-KR": "ko-KR/support.md",
        "en": "en/support.md"
      },
      "branches": [
        "evidence"
      ],
      "referenceIds": [],
      "claimIds": [],
      "architectureNodeIds": [
        "contract-evidence"
      ]
    },
    {
      "id": "explain",
      "labels": {
        "ko-KR": "Claude / GPT가 설명",
        "en": "Claude / GPT explains"
      },
      "content": {
        "ko-KR": "ko-KR/explain.md",
        "en": "en/explain.md"
      },
      "branches": [],
      "referenceIds": [],
      "claimIds": [],
      "architectureNodeIds": [
        "mcp"
      ]
    },
    {
      "id": "user",
      "labels": {
        "ko-KR": "내가 읽고 확인",
        "en": "I read and check"
      },
      "content": {
        "ko-KR": "ko-KR/user.md",
        "en": "en/user.md"
      },
      "branches": [],
      "referenceIds": [],
      "claimIds": [],
      "architectureNodeIds": [
        "contract-evidence"
      ]
    },
    {
      "id": "goal",
      "labels": {
        "ko-KR": "목표",
        "en": "Goal"
      },
      "content": {
        "ko-KR": "ko-KR/goal.md",
        "en": "en/goal.md"
      },
      "branches": [],
      "referenceIds": [],
      "claimIds": [],
      "architectureNodeIds": [
        "systems"
      ]
    },
    {
      "id": "design",
      "labels": {
        "ko-KR": "전체 설계",
        "en": "Architecture"
      },
      "content": {
        "ko-KR": "ko-KR/design.md",
        "en": "en/design.md"
      },
      "branches": [
        "boundaries"
      ],
      "referenceIds": [],
      "claimIds": [],
      "architectureNodeIds": [
        "contract-source"
      ]
    },
    {
      "id": "rules",
      "labels": {
        "ko-KR": "지켜야 할 규칙",
        "en": "Rules to preserve"
      },
      "content": {
        "ko-KR": "ko-KR/rules.md",
        "en": "en/rules.md"
      },
      "branches": [
        "version-rule",
        "governed",
        "relation-rule",
        "history"
      ],
      "referenceIds": [],
      "claimIds": [],
      "architectureNodeIds": [
        "contract-evidence"
      ]
    },
    {
      "id": "implementation",
      "labels": {
        "ko-KR": "코드 구현",
        "en": "Implementation"
      },
      "content": {
        "ko-KR": "ko-KR/implementation.md",
        "en": "en/implementation.md"
      },
      "branches": [
        "version-code",
        "replay",
        "executor",
        "storage-migration"
      ],
      "referenceIds": [],
      "claimIds": [],
      "architectureNodeIds": [
        "version"
      ]
    },
    {
      "id": "testing",
      "labels": {
        "ko-KR": "테스트",
        "en": "Testing"
      },
      "content": {
        "ko-KR": "ko-KR/testing.md",
        "en": "en/testing.md"
      },
      "branches": [
        "integrity-test",
        "passage"
      ],
      "referenceIds": [],
      "claimIds": [],
      "architectureNodeIds": [
        "F1"
      ]
    },
    {
      "id": "verification",
      "labels": {
        "ko-KR": "제대로 되는지 검증",
        "en": "Verification"
      },
      "content": {
        "ko-KR": "ko-KR/verification.md",
        "en": "en/verification.md"
      },
      "branches": [
        "integrity-proof",
        "health",
        "quality"
      ],
      "referenceIds": [],
      "claimIds": [],
      "architectureNodeIds": [
        "F1"
      ]
    },
    {
      "id": "recovery",
      "labels": {
        "ko-KR": "고장 후 복구 검증",
        "en": "Recovery validation"
      },
      "content": {
        "ko-KR": "ko-KR/recovery.md",
        "en": "en/recovery.md"
      },
      "branches": [
        "backup-set"
      ],
      "referenceIds": [],
      "claimIds": [],
      "architectureNodeIds": [
        "recovery"
      ]
    },
    {
      "id": "release",
      "labels": {
        "ko-KR": "릴리스 승인",
        "en": "Release acceptance"
      },
      "content": {
        "ko-KR": "ko-KR/release.md",
        "en": "en/release.md"
      },
      "branches": [
        "release-audit"
      ],
      "referenceIds": [],
      "claimIds": [
        "release-gate"
      ],
      "architectureNodeIds": [
        "release-gate"
      ]
    },
    {
      "id": "operations",
      "labels": {
        "ko-KR": "운영",
        "en": "Operations"
      },
      "content": {
        "ko-KR": "ko-KR/operations.md",
        "en": "en/operations.md"
      },
      "branches": [
        "audit"
      ],
      "referenceIds": [],
      "claimIds": [],
      "architectureNodeIds": [
        "doctor"
      ]
    },
    {
      "id": "improve",
      "labels": {
        "ko-KR": "측정·개선",
        "en": "Measure and improve"
      },
      "content": {
        "ko-KR": "ko-KR/improve.md",
        "en": "en/improve.md"
      },
      "branches": [
        "measure-runtime"
      ],
      "referenceIds": [],
      "claimIds": [],
      "architectureNodeIds": [
        "telemetry"
      ]
    },
    {
      "id": "evidence",
      "labels": {
        "ko-KR": "답변의 근거 확인",
        "en": "Check the answer’s evidence"
      },
      "content": {
        "ko-KR": "ko-KR/evidence.md",
        "en": "en/evidence.md"
      },
      "branches": [
        "version"
      ],
      "referenceIds": [],
      "claimIds": [],
      "term": "evidence",
      "documentId": "evidence",
      "architectureNodeIds": [
        "chunk"
      ]
    },
    {
      "id": "version",
      "labels": {
        "ko-KR": "당시 문서 상태",
        "en": "The document as it was"
      },
      "content": {
        "ko-KR": "ko-KR/version.md",
        "en": "en/version.md"
      },
      "branches": [
        "why-version"
      ],
      "referenceIds": [],
      "claimIds": [],
      "term": "version",
      "documentId": "document-version",
      "opposite": {
        "axis": "engineering",
        "node": "version-rule"
      },
      "architectureNodeIds": [
        "version"
      ]
    },
    {
      "id": "why-version",
      "labels": {
        "ko-KR": "왜 문서 버전을 보존할까?",
        "en": "Why preserve document versions?"
      },
      "content": {
        "ko-KR": "ko-KR/why-version.md",
        "en": "en/why-version.md"
      },
      "branches": [],
      "referenceIds": [],
      "claimIds": [],
      "term": "version",
      "documentId": "keep-versions",
      "opposite": {
        "axis": "engineering",
        "node": "version-rule"
      },
      "architectureNodeIds": [
        "version"
      ]
    },
    {
      "id": "version-rule",
      "labels": {
        "ko-KR": "원래 근거를 바꾸지 않는 규칙",
        "en": "Preserve the original evidence"
      },
      "content": {
        "ko-KR": "ko-KR/version-rule.md",
        "en": "en/version-rule.md"
      },
      "branches": [
        "version-code"
      ],
      "referenceIds": [
        "ref:docs/architecture/0001-stable-context-contracts.md",
        "ref:config/contracts.yaml"
      ],
      "claimIds": [],
      "term": "version",
      "documentId": "document-version",
      "opposite": {
        "axis": "runtime",
        "node": "version",
        "journey": "read"
      },
      "architectureNodeIds": [
        "contract-evidence"
      ]
    },
    {
      "id": "version-code",
      "labels": {
        "ko-KR": "그 규칙을 저장 코드에 적용",
        "en": "Enforce the rule in storage"
      },
      "content": {
        "ko-KR": "ko-KR/version-code.md",
        "en": "en/version-code.md"
      },
      "branches": [
        "integrity-test"
      ],